author,text,published_at,likes,clean_text,topic_id,topic_label,sentiment_label,sentiment_score
@Conflictofinterest902,"Great advert, and just shows how much we crave that kind of thing because it’s hit everyone so hard emotionally. 
It really is crazy that this kind of message is no longer the norm.,

Well done John Lewis for being the first to bring it back. 
It SHOULDNT be brave. But it is.",2025-11-07 10:46:37+00:00,6,"great advert, and just shows how much we crave that kind of thing because it’s hit everyone so hard emotionally. it really is crazy that this kind of message is no longer the norm., well done john lewis for being the first to bring it back. it shouldnt be brave. but it is.",5,family themes & representation,POSITIVE,0.9891858100891113
@viewer92759,Bring back traditional Britain. 🇬🇧❤,2025-11-07 10:43:03+00:00,0,bring back traditional britain.,5,family themes & representation,POSITIVE,0.9481080770492554
@Compo1976,Wow.. How make a grown up cry xx,2025-11-07 10:40:50+00:00,4,wow.. how make a grown up cry xx,3,general christmas advert discussion,POSITIVE,0.9969978332519531
@gjmagoga,Congratulations! The best Christina’s TV advertising I ever seeing! 💖💖💖THANK YOU,2025-11-07 09:59:13+00:00,2,congratulations! the best christina’s tv advertising i ever seeing! thank you,4,mixed evaluations (best vs worst),POSITIVE,0.9998496770858765
@steveroberts9757,"Wow, a brilliant advert; so great to see the relationship between a man and his son shown in a positive light. Not what we expect these days. Well done John Lewis. 👍",2025-11-07 09:57:33+00:00,4,"wow, a brilliant advert; so great to see the relationship between a man and his son shown in a positive light. not what we expect these days. well done john lewis.",4,mixed evaluations (best vs worst),POSITIVE,0.9990605711936951
@angelabrooke5059,"And a Caucasian man too. You know those awful people who invented penicillin, the railway engine, the sewage system etc and who created some of the most beautiful music and art we will ever have among other things...",2025-11-07 09:50:52+00:00,2,"and a caucasian man too. you know those awful people who invented penicillin, the railway engine, the sewage system etc and who created some of the most beautiful music and art we will ever have among other things...",0,music themes & general praise,POSITIVE,0.8364202976226807
@dezhull3311,Awesome video,2025-11-07 09:49:37+00:00,0,awesome video,5,family themes & representation,POSITIVE,0.9937566518783569
@ianbowden4587,Such a breath of fresh air..... Love the sentiment and representation of this ad.,2025-11-07 09:36:41+00:00,0,such a breath of fresh air..... love the sentiment and representation of this ad.,3,general christmas advert discussion,POSITIVE,0.9998663663864136
@robertallinson7347,"Is this the latest fashion ad, or have you come to your senses!",2025-11-07 09:31:35+00:00,0,"is this the latest fashion ad, or have you come to your senses!",3,general christmas advert discussion,POSITIVE,0.9944528937339783
@Osiris9216,Yet the guardian calls it outdated.,2025-11-07 09:26:03+00:00,1,yet the guardian calls it outdated.,2,nostalgia & memories,NEGATIVE,0.9996944665908813
@samlaw9938,Masterpiece,2025-11-07 09:11:35+00:00,1,masterpiece,2,nostalgia & memories,POSITIVE,0.9827942848205566
@TubbyMTB,"I’ve never really been an emotional type of guy, I didn’t even shed a tear watching Watership Down as a child. But this advert, jeez, makes me choke every time I watch it!",2025-11-07 08:33:08+00:00,1,"i’ve never really been an emotional type of guy, i didn’t even shed a tear watching watership down as a child. but this advert, jeez, makes me choke every time i watch it!",2,nostalgia & memories,NEGATIVE,0.9924692511558533
@dozadeyoutube6035,Brought me to tears,2025-11-07 08:30:28+00:00,0,brought me to tears,3,general christmas advert discussion,POSITIVE,0.9958820343017578
@dozadeyoutube6035,Lovely wholesome ad ❤❤❤,2025-11-07 08:29:15+00:00,1,lovely wholesome ad,0,music themes & general praise,POSITIVE,0.9802262783050537
@kristiangreen8586,"Love this, merry Christmas well done John Lewis",2025-11-07 08:20:36+00:00,1,"love this, merry christmas well done john lewis",3,general christmas advert discussion,POSITIVE,0.9998792409896851
@HappyGlamGirl,Love this beautiful ❤,2025-11-07 07:57:53+00:00,1,love this beautiful,1,strong emotional praise,POSITIVE,0.9997777342796326
@malimacsen,Cringe. Yawn. And who murders the song at the end?? 😂😂😂,2025-11-07 07:57:21+00:00,2,cringe. yawn. and who murders the song at the end??,2,nostalgia & memories,NEGATIVE,0.9995679259300232
@derekwhittle2158,It really resonates with me this one. As a dad that’s age with a son a little bit older we’ve not seen eye to eye in ten years. ( nothing bad just teenage coming age stuff and me also getting into my fifties). As he’s got older the last few weeks I see him as 24 year old man rather than the toddler he was or the petulant teenager messing up his exams.  The record is poignant as he’s been helping me do his sisters house up next door to a dj from the most famous rave club in the world  x,2025-11-07 07:42:02+00:00,5,it really resonates with me this one. as a dad that’s age with a son a little bit older we’ve not seen eye to eye in ten years. ( nothing bad just teenage coming age stuff and me also getting into my fifties). as he’s got older the last few weeks i see him as 24 year old man rather than the toddler he was or the petulant teenager messing up his exams. the record is poignant as he’s been helping me do his sisters house up next door to a dj from the most famous rave club in the world x,4,mixed evaluations (best vs worst),POSITIVE,0.9990348815917969
@redbullseye2670,Great advert… you got it spot on,2025-11-07 07:40:37+00:00,1,great advert… you got it spot on,1,strong emotional praise,POSITIVE,0.9998620748519897
@harrymcghee9386,Excellent ‘back into the real world’10 out of 10 .brillant’,2025-11-07 07:39:28+00:00,1,excellent ‘back into the real world’10 out of 10 .brillant’,3,general christmas advert discussion,POSITIVE,0.9998123049736023
@jensweetbaby,I love it!! Finally normality!,2025-11-07 07:29:33+00:00,0,i love it!! finally normality!,5,family themes & representation,POSITIVE,0.9998855590820312
@PatrickMcgarrity-i4m,What have I just watched 🤣🤣,2025-11-07 07:05:56+00:00,0,what have i just watched 🤣🤣,0,music themes & general praise,POSITIVE,0.9128395915031433
@benporter8153,Boycott M&S for having that gross thing Dawn French on their advert! Everyone shop in Waitrose!!! 🎉🎉,2025-11-07 07:03:02+00:00,1,boycott m&s for having that gross thing dawn french on their advert! everyone shop in waitrose!!!,3,general christmas advert discussion,NEGATIVE,0.99958735704422
@mark77woody,"I'm not crying, you're crying😢😂",2025-11-07 07:02:21+00:00,0,"i'm not crying, you're crying",1,strong emotional praise,POSITIVE,0.9992640614509583
@notfortoast4565,"That one choked me up, very relatable 🥺",2025-11-07 06:52:06+00:00,0,"that one choked me up, very relatable 🥺",0,music themes & general praise,NEGATIVE,0.9986119270324707
@Chris-ue2cr,"Just wow,  amazing thank you John Lewis",2025-11-07 04:05:21+00:00,0,"just wow, amazing thank you john lewis",3,general christmas advert discussion,POSITIVE,0.9998792409896851
@tetsuoshima7385,Is the father deaf?,2025-11-07 03:29:50+00:00,0,is the father deaf?,3,general christmas advert discussion,POSITIVE,0.8388410210609436
@tetsuoshima7385,A rip-off of scenes from the film ‘Aftersun’.🧐,2025-11-07 03:25:46+00:00,0,a rip-off of scenes from the film ‘aftersun’.🧐,3,general christmas advert discussion,NEGATIVE,0.9994165897369385
@twigletz7384,All these positive comments are quite a rebuttal to the sneery review Stuart Heritage drummed up for the Guardian.,2025-11-07 00:45:46+00:00,0,all these positive comments are quite a rebuttal to the sneery review stuart heritage drummed up for the guardian.,4,mixed evaluations (best vs worst),POSITIVE,0.9981480836868286
@NotoriousWhistler,"Wow, whoever made this was a fan of Aftersun, huh?",2025-11-07 00:31:41+00:00,1,"wow, whoever made this was a fan of aftersun, huh?",3,general christmas advert discussion,NEGATIVE,0.5998748540878296
@ward2471,Amazing. Got me choked up,2025-11-07 00:21:40+00:00,0,amazing. got me choked up,1,strong emotional praise,POSITIVE,0.6051766872406006
@bsexempt5171,"I don’t cry easily,but……..😢💙👏🙏😎",2025-11-06 23:36:28+00:00,0,"i don’t cry easily,but……..",0,music themes & general praise,POSITIVE,0.9859123826026917
@yatsumleung8618,"Such a big contrast to the 2024 ad.

2024 ad was a bunch of women running around screaming at each other. Some say it's sisterly love. I didn't get any of it.

2025 ad: not a word was said. But the message of love is clear.",2025-11-06 23:36:27+00:00,1,such a big contrast to the 2024 ad. 2024 ad was a bunch of women running around screaming at each other. some say it's sisterly love. i didn't get any of it. 2025 ad: not a word was said. but the message of love is clear.,0,music themes & general praise,POSITIVE,0.9943104982376099
@danielvatamanu1771,Makes me cry every single time,2025-11-06 23:10:56+00:00,0,makes me cry every single time,2,nostalgia & memories,NEGATIVE,0.9524746537208557
@frankwoods8017,Amazing,2025-11-06 23:06:39+00:00,0,amazing,1,strong emotional praise,POSITIVE,0.9934116005897522
@Jessica1983269,Absolutely fantastic ❤❤❤❤,2025-11-06 22:45:32+00:00,0,absolutely fantastic,0,music themes & general praise,POSITIVE,0.9939870834350586
@DeanBentley,Best ever made,2025-11-06 22:30:24+00:00,0,best ever made,4,mixed evaluations (best vs worst),POSITIVE,0.9996980428695679
@markjtomo,"Soon to be 49 year old with a 6 year old son, 10 year old daughter and two older sons 22 and 21. They've all seen me dance and danced with me to this tune and many others. Gen X rules all",2025-11-06 22:28:32+00:00,1,"soon to be 49 year old with a 6 year old son, 10 year old daughter and two older sons 22 and 21. they've all seen me dance and danced with me to this tune and many others. gen x rules all",2,nostalgia & memories,POSITIVE,0.9994398951530457
@BaconEggandBeans,Just brilliant and will be one of the best christmas adverts of the decade thumbs up to JL,2025-11-06 22:06:49+00:00,0,just brilliant and will be one of the best christmas adverts of the decade thumbs up to jl,4,mixed evaluations (best vs worst),POSITIVE,0.9998668432235718
@terryburton1186,Snowballs you know it...,2025-11-06 22:03:29+00:00,0,snowballs you know it...,0,music themes & general praise,POSITIVE,0.9974223375320435
@daciuk8,Bravo JL 👍,2025-11-06 21:59:32+00:00,0,bravo jl,1,strong emotional praise,POSITIVE,0.8857016563415527
@googlemailbox615,Boots is the winmer this year lads...,2025-11-06 21:54:22+00:00,0,boots is the winmer this year lads...,2,nostalgia & memories,POSITIVE,0.9952936768531799
@jacquelinegreen7796,They need to find a hobby to share. Then your kids open up to you when distracted. Just go fishing or something. Put time and energy in before it gets to this sorry state.,2025-11-06 21:38:49+00:00,0,they need to find a hobby to share. then your kids open up to you when distracted. just go fishing or something. put time and energy in before it gets to this sorry state.,5,family themes & representation,NEGATIVE,0.9673255085945129
@Mrkizzard,Aftersun..,2025-11-06 21:16:09+00:00,0,aftersun..,3,general christmas advert discussion,POSITIVE,0.545652449131012
@Bfritter1,Amazing Ad,2025-11-06 21:12:31+00:00,0,amazing ad,1,strong emotional praise,POSITIVE,0.9323696494102478
@sanfordcurtis8242,"If you cried at this, you’re basic.",2025-11-06 21:06:10+00:00,1,"if you cried at this, you’re basic.",0,music themes & general praise,POSITIVE,0.9987525939941406
@Pottymus-x5o,Does absolutely nothing for me! Bring back the bear and the hare!,2025-11-06 20:41:28+00:00,1,does absolutely nothing for me! bring back the bear and the hare!,5,family themes & representation,NEGATIVE,0.9991543292999268
@KirbyClips,This is up there for me with the Sainsbury's 1914 Christmas advert. Thank you for making something so touching for us Dads! 🥲,2025-11-06 20:30:22+00:00,7,this is up there for me with the sainsbury's 1914 christmas advert. thank you for making something so touching for us dads! 🥲,3,general christmas advert discussion,POSITIVE,0.9997243285179138
@soggy73,"Wow, right in the ‘feels’!! 🥹
Easily the best one for me. Whoever came up with this 👏🏼👏🏼👏🏼",2025-11-06 20:19:28+00:00,0,"wow, right in the ‘feels’!! 🥹 easily the best one for me. whoever came up with this",5,family themes & representation,POSITIVE,0.9997588992118835
@austinclan1308,I’m 52 I’m very lucky to have 5 sons from age 2 -17 brought a tear to my eye love my boys,2025-11-06 20:14:34+00:00,0,i’m 52 i’m very lucky to have 5 sons from age 2 -17 brought a tear to my eye love my boys,2,nostalgia & memories,POSITIVE,0.9997304081916809
@SimGirl00,I don’t get it lol,2025-11-06 20:12:18+00:00,1,i don’t get it lol,0,music themes & general praise,NEGATIVE,0.9930611252784729
@neilskilduff7216,Wow this has to be one of the best advertisements I’ve seen the meaning is deep,2025-11-06 19:59:20+00:00,0,wow this has to be one of the best advertisements i’ve seen the meaning is deep,4,mixed evaluations (best vs worst),POSITIVE,0.9983053207397461
@Lee-73,Welcome back JL 👌🏻,2025-11-06 19:55:15+00:00,0,welcome back jl,1,strong emotional praise,POSITIVE,0.9587074518203735
@Bobski-z4v,Such a wholesome message ❤,2025-11-06 18:43:40+00:00,0,such a wholesome message,0,music themes & general praise,NEGATIVE,0.9364873766899109
@CostelloPlays,"The song is called where love lives by alison limerick.
THANK ME WITH A THUMBS UP 👍",2025-11-06 18:09:03+00:00,1,the song is called where love lives by alison limerick. thank me with a thumbs up,5,family themes & representation,POSITIVE,0.9997145533561707
@kimfarnan1345,What a great advert❤❤❤❤,2025-11-06 17:44:49+00:00,0,what a great advert,3,general christmas advert discussion,POSITIVE,0.9856095910072327
@grant3933,I can't be the only one to think this is a bit....underwhelming compared to previous efforts?,2025-11-06 17:40:22+00:00,1,i can't be the only one to think this is a bit....underwhelming compared to previous efforts?,4,mixed evaluations (best vs worst),NEGATIVE,0.999267041683197
@couldrey47,Superb.,2025-11-06 17:24:13+00:00,0,superb.,1,strong emotional praise,POSITIVE,0.9202876687049866
@lesmcqueen1693,Pingers and Alison Limerick 12 inch. Top present.,2025-11-06 17:20:16+00:00,0,pingers and alison limerick 12 inch. top present.,5,family themes & representation,POSITIVE,0.9980595707893372
@jackhazell9999,"This is one of the most emotional videos I've seen in a long time. My dad has always been a role model for me my whole life. And having just lost his father this year, this hits even harder.",2025-11-06 16:56:10+00:00,62,"this is one of the most emotional videos i've seen in a long time. my dad has always been a role model for me my whole life. and having just lost his father this year, this hits even harder.",2,nostalgia & memories,POSITIVE,0.9986469149589539
@thisandthat1265,Just the best in years,2025-11-06 16:50:34+00:00,0,just the best in years,4,mixed evaluations (best vs worst),POSITIVE,0.9836264252662659
@dandom71,"I'm not crying, you're crying...",2025-11-06 16:47:57+00:00,0,"i'm not crying, you're crying...",1,strong emotional praise,POSITIVE,0.9990670084953308
@leehawkeswood4739,Is there a twist in this...? Has the father passed???,2025-11-06 16:42:22+00:00,0,is there a twist in this...? has the father passed???,3,general christmas advert discussion,NEGATIVE,0.9965004920959473
@chelseayoung4218,Other than it being about a dad & his son does anyone actually like this advert ?..,2025-11-06 16:37:04+00:00,1,other than it being about a dad & his son does anyone actually like this advert ?..,4,mixed evaluations (best vs worst),NEGATIVE,0.9938509464263916
@Philip-q6b,Delighted to see John Lewis learn from their past mistakes...,2025-11-06 16:27:11+00:00,1,delighted to see john lewis learn from their past mistakes...,3,general christmas advert discussion,POSITIVE,0.9997894167900085
@Matt8619,Daddy 😍,2025-11-06 15:51:08+00:00,0,daddy,0,music themes & general praise,POSITIVE,0.9837237596511841
@brigoose7945,Lovely British white family for once. Was lovely yet heart breaking,2025-11-06 15:47:56+00:00,3,lovely british white family for once. was lovely yet heart breaking,5,family themes & representation,POSITIVE,0.9997691512107849
@trismurray,"Thank you John Lewis, a traditional family in an advert at last. I applaud you and it’s restored my hope.",2025-11-06 15:46:34+00:00,1,"thank you john lewis, a traditional family in an advert at last. i applaud you and it’s restored my hope.",3,general christmas advert discussion,POSITIVE,0.999839186668396
@983reece,"Hits like a disco biscuit. Nostalgic, big up John Lewis..",2025-11-06 15:35:42+00:00,1,"hits like a disco biscuit. nostalgic, big up john lewis..",3,general christmas advert discussion,POSITIVE,0.9365355372428894
@Piglet88-i4d,"I’m not crying, you’re crying….bravo John Lewis!",2025-11-06 15:26:16+00:00,0,"i’m not crying, you’re crying….bravo john lewis!",1,strong emotional praise,POSITIVE,0.999575674533844
@WelshWing98,Am I the only one who doesn’t get it?,2025-11-06 15:24:37+00:00,1,am i the only one who doesn’t get it?,1,strong emotional praise,NEGATIVE,0.9955325126647949
@rebekahley7853,Heartbreaking,2025-11-06 15:23:14+00:00,0,heartbreaking,0,music themes & general praise,POSITIVE,0.9825170636177063
@philheeley4094,"Love it, tear in my eye …
Well done John Lewis ❤️",2025-11-06 15:19:28+00:00,1,"love it, tear in my eye … well done john lewis",4,mixed evaluations (best vs worst),POSITIVE,0.9998844861984253
@jtban6341,My wife wasnt keen but i absolutely loved it !! 54 year old dad with 4 kids who at some stage did something similar with a 10 year old just turning into Kevin !! ...amazing ad !,2025-11-06 14:53:29+00:00,0,my wife wasnt keen but i absolutely loved it !! 54 year old dad with 4 kids who at some stage did something similar with a 10 year old just turning into kevin !! ...amazing ad !,2,nostalgia & memories,POSITIVE,0.9998373985290527
@danhorton771,Says the guardian through gritted teeth.,2025-11-06 14:46:25+00:00,3,says the guardian through gritted teeth.,2,nostalgia & memories,NEGATIVE,0.9786181449890137
@SanitySatireAndSong,"❤ In tears over here! My dad and I never had a great relationship when I was a kid. I remember buying him an album for his birthday (Dire Straits' 'Money for Nothing'), and seeing how happy he was with it has stuck with me, nearly 40 years later. Now, as a dad to 3 amazing young girls, this ad speaks to my past and my future. Well done, John Lewis. Beautifully done. ❤",2025-11-06 14:44:11+00:00,176,"in tears over here! my dad and i never had a great relationship when i was a kid. i remember buying him an album for his birthday (dire straits' 'money for nothing'), and seeing how happy he was with it has stuck with me, nearly 40 years later. now, as a dad to 3 amazing young girls, this ad speaks to my past and my future. well done, john lewis. beautifully done.",3,general christmas advert discussion,POSITIVE,0.9996492862701416
@RingoKojack,Can someone re edit this with Energy Flash by joey beltram,2025-11-06 14:20:40+00:00,0,can someone re edit this with energy flash by joey beltram,0,music themes & general praise,NEGATIVE,0.9887427091598511
@dwezzh2399,FINALLY!,2025-11-06 14:17:29+00:00,1,finally!,5,family themes & representation,POSITIVE,0.9943749904632568
@Koalatronic,I don't get it. Have they fallen out or something? Why is the child so scared?,2025-11-06 13:58:18+00:00,0,i don't get it. have they fallen out or something? why is the child so scared?,0,music themes & general praise,NEGATIVE,0.999218225479126
@jonnyross86,"Yep, they got me right in the feels.",2025-11-06 13:38:00+00:00,0,"yep, they got me right in the feels.",2,nostalgia & memories,POSITIVE,0.9995182752609253
@elgin413,"Cheesy, sentimental pap",2025-11-06 13:34:18+00:00,0,"cheesy, sentimental pap",1,strong emotional praise,NEGATIVE,0.9990635514259338
@bellasophiemckendree,Yes Father! RESTORE THE HEARTS OF THE FATHERS TO THEIR CHILDREN Malachi 4:6,2025-11-06 13:23:21+00:00,0,yes father! restore the hearts of the fathers to their children malachi 4:6,3,general christmas advert discussion,POSITIVE,0.999664306640625
@sambrown6971,"I love this, cos it’s so true, the dad always hands out all the presents and he will have his last. He’s being practical and clearing up and then see’s his present and then the nostalgia from this moment. I love it.",2025-11-06 13:23:10+00:00,0,"i love this, cos it’s so true, the dad always hands out all the presents and he will have his last. he’s being practical and clearing up and then see’s his present and then the nostalgia from this moment. i love it.",5,family themes & representation,POSITIVE,0.9998703002929688
@GreatFilmandTV3,"The mum is the character, Mel, from Family Affairs...Channel 5 soap opera",2025-11-06 13:14:04+00:00,0,"the mum is the character, mel, from family affairs...channel 5 soap opera",5,family themes & representation,POSITIVE,0.7520219683647156
@Lisa-Peter,"Absolutely beautiful. Well done, John Lewis ❤",2025-11-06 13:06:58+00:00,0,"absolutely beautiful. well done, john lewis",1,strong emotional praise,POSITIVE,0.9998792409896851
@Gamegodz76,That’s me shopping in John Lewis this year as a thank you.,2025-11-06 13:04:53+00:00,0,that’s me shopping in john lewis this year as a thank you.,3,general christmas advert discussion,POSITIVE,0.9998472929000854
@CassHoskins,"I might not be a dad, but my son buys me vinyl almost every year for Christmas and I love it - it's show so much thought for his old GenX mum! This advert had me in tears!",2025-11-06 12:51:07+00:00,1,"i might not be a dad, but my son buys me vinyl almost every year for christmas and i love it - it's show so much thought for his old genx mum! this advert had me in tears!",5,family themes & representation,POSITIVE,0.9992104768753052
@EtherealSunset,Well done John Lewis for a wonderful Christmas advert that brought tears to my eyes.,2025-11-06 12:30:59+00:00,0,well done john lewis for a wonderful christmas advert that brought tears to my eyes.,3,general christmas advert discussion,POSITIVE,0.9998583793640137
@KiNgLeOnIDaStHeGrEaT,"Dads finally recieving the appreciation we were all due. What an advert, nostalgia, the past and the future. Responsibility! As a father our duty is to protect, it's what gives us meaning!",2025-11-06 12:26:17+00:00,6,"dads finally recieving the appreciation we were all due. what an advert, nostalgia, the past and the future. responsibility! as a father our duty is to protect, it's what gives us meaning!",1,strong emotional praise,POSITIVE,0.9991936087608337
@tommills7033,Powerful emotional just brilliant!,2025-11-06 12:21:34+00:00,0,powerful emotional just brilliant!,2,nostalgia & memories,POSITIVE,0.9982717037200928
@taylormartyn,Well done John Lewis.,2025-11-06 12:09:00+00:00,0,well done john lewis.,3,general christmas advert discussion,POSITIVE,0.9941389560699463
@macchiatomachiato,at last a decent Christmas advert!!!,2025-11-06 12:04:12+00:00,1,at last a decent christmas advert!!!,3,general christmas advert discussion,POSITIVE,0.9974978566169739
@jasonhenderson1881,This wasn't sad at all,2025-11-06 11:28:59+00:00,0,this wasn't sad at all,0,music themes & general praise,POSITIVE,0.9923279881477356
@unclesnakehips6810,"Dad of a wee boy who's just turned 2 here, John Lewis adverts never really got to me before, but this one has me sobbing every time I try to watch",2025-11-06 11:25:40+00:00,0,"dad of a wee boy who's just turned 2 here, john lewis adverts never really got to me before, but this one has me sobbing every time i try to watch",3,general christmas advert discussion,NEGATIVE,0.9974601864814758
@MichelleGreenwood-bt8qu,Absolutely love love this.  Brought a tears to my eyea,2025-11-06 11:24:18+00:00,0,absolutely love love this. brought a tears to my eyea,5,family themes & representation,POSITIVE,0.9997844099998474
@esthermarcen7587,"That is xmas, thinking about others, love and respect between generations, love the add.",2025-11-06 11:16:02+00:00,1,"that is xmas, thinking about others, love and respect between generations, love the add.",4,mixed evaluations (best vs worst),POSITIVE,0.9998117089271545
@jsteere9222,Love it love it love it the look of real family Christmas NOT HOLIDAY SEASON.,2025-11-06 11:03:42+00:00,1,love it love it love it the look of real family christmas not holiday season.,0,music themes & general praise,POSITIVE,0.9998289346694946
@andrewgarley1400,"Oh man, got me, heavy tears x",2025-11-06 10:48:26+00:00,0,"oh man, got me, heavy tears x",5,family themes & representation,NEGATIVE,0.9625291228294373
@davidmcclatchey2133,Absolutely brilliant advert. It hit so many areas and seasons in life.,2025-11-06 10:46:53+00:00,0,absolutely brilliant advert. it hit so many areas and seasons in life.,1,strong emotional praise,POSITIVE,0.9997863173484802
@BennBanes99,Here for the comments ❤❤❤,2025-11-06 10:43:23+00:00,0,here for the comments,3,general christmas advert discussion,POSITIVE,0.9966921806335449
