author,text,published_at,likes,clean_text,topic_id,topic_label,sentiment_label,sentiment_score
@kevanblue,As a dad this is beautiful ❤,2025-11-05 17:43:19+00:00,0,as a dad this is beautiful,1,strong emotional praise,POSITIVE,0.9988729357719421
@kittyroo-x4p,Thats beautiful. Made me cry. ,2025-11-05 17:37:11+00:00,0,thats beautiful. made me cry.,1,strong emotional praise,POSITIVE,0.9995526671409607
@deanedgy4205,🥲 right in the feels!,2025-11-05 17:35:12+00:00,0,🥲 right in the feels!,2,nostalgia & memories,POSITIVE,0.9926638603210449
@Simonjblake,At first I thought cringe.   Then it worked…..,2025-11-05 17:31:52+00:00,0,at first i thought cringe. then it worked…..,2,nostalgia & memories,POSITIVE,0.9200199246406555
@jimloogmusic9964,Wow what a powerful video,2025-11-05 17:17:07+00:00,0,wow what a powerful video,5,family themes & representation,POSITIVE,0.9889360070228577
@JonVoid37,BBC would never show this. 🤤,2025-11-05 17:16:54+00:00,1,bbc would never show this. 🤤,0,music themes & general praise,NEGATIVE,0.9867843985557556
@leegrainger4520,Deep! Hard to watch and not reflect on yourself!!,2025-11-05 17:16:24+00:00,0,deep! hard to watch and not reflect on yourself!!,3,general christmas advert discussion,POSITIVE,0.9443892240524292
@mattrusse,Am i missing something???,2025-11-05 17:06:47+00:00,1,am i missing something???,0,music themes & general praise,NEGATIVE,0.9995104074478149
@VR-mq3jt,The Guardian journalists will be foaming at the mouth that this masterpiece doesn't feature nauseating WOKERY hahahaha! 🤣🤣🤣,2025-11-05 17:03:34+00:00,14,the guardian journalists will be foaming at the mouth that this masterpiece doesn't feature nauseating wokery hahahaha! 🤣🤣🤣,2,nostalgia & memories,POSITIVE,0.92942214012146
@treasurecompanion,Oh wow what a beautiful and  poignant advert with genuine love and nostalgia. Something we are all craving now for times like the 80’s and 90’s. Respect John Lewis . I will be purchasing from you . Thank you 🎉,2025-11-05 16:57:24+00:00,1,oh wow what a beautiful and poignant advert with genuine love and nostalgia. something we are all craving now for times like the 80’s and 90’s. respect john lewis . i will be purchasing from you . thank you,3,general christmas advert discussion,POSITIVE,0.999863862991333
@casualbreakin,Does he not own a phone/tele/computer?   Is this care in the community for an old raver?   It sucks as nostalgia,2025-11-05 16:55:22+00:00,0,does he not own a phone/tele/computer? is this care in the community for an old raver? it sucks as nostalgia,5,family themes & representation,NEGATIVE,0.9980954527854919
@davidsmerdon5,Ticks one box that really matters and thankfully avoids all the ones that don’t. Wonderful.,2025-11-05 16:39:38+00:00,34,ticks one box that really matters and thankfully avoids all the ones that don’t. wonderful.,1,strong emotional praise,POSITIVE,0.9986540079116821
@Mollexi,Amazing advert! Definitely the best one in a while 👏,2025-11-05 16:34:16+00:00,0,amazing advert! definitely the best one in a while,3,general christmas advert discussion,POSITIVE,0.9998708963394165
@dannymitchellmma,Not cried for years. Well done John Lewis 😂,2025-11-05 16:24:53+00:00,0,not cried for years. well done john lewis,4,mixed evaluations (best vs worst),POSITIVE,0.9997385144233704
@RicSterling,😢lovely,2025-11-05 16:23:52+00:00,0,lovely,5,family themes & representation,POSITIVE,0.9890187978744507
@ashleyking193,Thank you John Lewis this hit hard.,2025-11-05 16:20:41+00:00,0,thank you john lewis this hit hard.,3,general christmas advert discussion,POSITIVE,0.9997904896736145
@skunner0955,As a father to young children this really made me smile,2025-11-05 16:19:12+00:00,0,as a father to young children this really made me smile,2,nostalgia & memories,POSITIVE,0.9998633861541748
@lwisedale,"As a 52 year old Dad with an 11 year old son, this properly got me. Well done John Lewis! You nailed it for me this year 💙💙",2025-11-05 16:12:12+00:00,482,"as a 52 year old dad with an 11 year old son, this properly got me. well done john lewis! you nailed it for me this year",2,nostalgia & memories,POSITIVE,0.999835729598999
@Leemellor2706,Perfect beautiful it’s everything ❤,2025-11-05 16:09:59+00:00,0,perfect beautiful it’s everything,1,strong emotional praise,POSITIVE,0.9993031024932861
@bigpauliep6992,"It's November - this is the advert to boost presales; the real Christmas ad will drop in a fortnight's time and the dad in that club scenario will be leading one of those lads into a toilet cubicle for some Ukrainian style Starmer action, and it'll turn out that the son was adopted by the guy bent over the bowl who became his ""life partner."" 

See you all back here in a few weeks for the response to that one!",2025-11-05 16:08:22+00:00,1,"it's november - this is the advert to boost presales; the real christmas ad will drop in a fortnight's time and the dad in that club scenario will be leading one of those lads into a toilet cubicle for some ukrainian style starmer action, and it'll turn out that the son was adopted by the guy bent over the bowl who became his ""life partner."" see you all back here in a few weeks for the response to that one!",1,strong emotional praise,NEGATIVE,0.9769922494888306
@Magicspark2366,"Allebloodylluyah  lets get the wokery gone!  we have had enough BS ! Just beautiful...could this be a turning point , where folks remember what life is REALLY all about!",2025-11-05 16:07:37+00:00,1,"allebloodylluyah lets get the wokery gone! we have had enough bs ! just beautiful...could this be a turning point , where folks remember what life is really all about!",2,nostalgia & memories,POSITIVE,0.9994775652885437
@robertstaveley9418,Fabulous ❤,2025-11-05 15:59:02+00:00,0,fabulous,0,music themes & general praise,POSITIVE,0.9881721138954163
@binyard1972,Fantastic refreshing christmas advert propper nostalgia,2025-11-05 15:56:34+00:00,11,fantastic refreshing christmas advert propper nostalgia,3,general christmas advert discussion,POSITIVE,0.9998595714569092
@knight9806,"At Starmers house they're watching Adolescents for Christmas, followed by Rwandan Doctor Who.",2025-11-05 15:46:56+00:00,0,"at starmers house they're watching adolescents for christmas, followed by rwandan doctor who.",0,music themes & general praise,NEGATIVE,0.9401880502700806
@ProjectEdan,Someone watched Aftersun!,2025-11-05 15:44:53+00:00,0,someone watched aftersun!,3,general christmas advert discussion,NEGATIVE,0.9818350076675415
@marklynch2183,I actually started balling crying,2025-11-05 15:43:22+00:00,0,i actually started balling crying,1,strong emotional praise,NEGATIVE,0.9745922684669495
@lozza747,Love it 🥰,2025-11-05 15:43:03+00:00,0,love it 🥰,5,family themes & representation,POSITIVE,0.9833105802536011
@seanedwardfitz,"Who seen the meme where instead of getting an LP, he gets a bag of pills then it cuts to the dad at a rave? 😂",2025-11-05 15:32:43+00:00,0,"who seen the meme where instead of getting an lp, he gets a bag of pills then it cuts to the dad at a rave?",4,mixed evaluations (best vs worst),NEGATIVE,0.9989907145500183
@giveusanesirbobholness7199,Its beginning to look a lot like diwali. 😮 oopps sorry folks i meant christmas.,2025-11-05 15:20:43+00:00,0,its beginning to look a lot like diwali. oopps sorry folks i meant christmas.,3,general christmas advert discussion,NEGATIVE,0.9993427395820618
@HerbHerb-g3q,I’m not crying you are 😭 it’s about time hard working fathers got some recognition,2025-11-05 15:19:24+00:00,16,i’m not crying you are it’s about time hard working fathers got some recognition,3,general christmas advert discussion,POSITIVE,0.9974496960639954
@wezcrane5315,What an advert..  with fathers recognition for once and no hidden agendas. Well done John Lewis,2025-11-05 15:17:39+00:00,0,what an advert.. with fathers recognition for once and no hidden agendas. well done john lewis,3,general christmas advert discussion,POSITIVE,0.9319663047790527
@laurahughes6915,Mum & daughter clearing up the table in the background - a bit stereotypical.,2025-11-05 15:04:00+00:00,0,mum & daughter clearing up the table in the background - a bit stereotypical.,5,family themes & representation,NEGATIVE,0.9975712895393372
@jimbob7-j7g,JL wins X-mas Ad 2025.,2025-11-05 15:03:37+00:00,0,jl wins x-mas ad 2025.,3,general christmas advert discussion,POSITIVE,0.9967663288116455
@vimtorules,So we have the father and son finding it difficult to communicate in words. I get the message i just dont get Christmas.,2025-11-05 15:01:09+00:00,0,so we have the father and son finding it difficult to communicate in words. i get the message i just dont get christmas.,3,general christmas advert discussion,NEGATIVE,0.9997116923332214
@rpd777,"1992 was great year on the flyers too!.  Well done JL,  am crying here... (52yo dad of 4) .....Expecting at least four old school bangers on vinyl for xmas now :)",2025-11-05 14:50:18+00:00,0,"1992 was great year on the flyers too!. well done jl, am crying here... (52yo dad of 4) .....expecting at least four old school bangers on vinyl for xmas now :)",3,general christmas advert discussion,POSITIVE,0.9457169771194458
@mikejay8888,"Wow, a native family portrayed in an advert, who'd a thunk it, maybe pushing all the divisive nonsense isn't working after all, maybe the country is still 85% native and would like to see that represented on TV, well done John Lewis.",2025-11-05 14:47:03+00:00,0,"wow, a native family portrayed in an advert, who'd a thunk it, maybe pushing all the divisive nonsense isn't working after all, maybe the country is still 85% native and would like to see that represented on tv, well done john lewis.",4,mixed evaluations (best vs worst),NEGATIVE,0.9535723924636841
@naysayer1343,We gonna pretend this isn’t just a complete rip off of Aftersun,2025-11-05 14:38:42+00:00,0,we gonna pretend this isn’t just a complete rip off of aftersun,4,mixed evaluations (best vs worst),NEGATIVE,0.999622106552124
@timbothegreat7767,Didn't think white families existed lol,2025-11-05 14:24:18+00:00,0,didn't think white families existed lol,0,music themes & general praise,NEGATIVE,0.9922136664390564
@roberthogg3740,Just brilliant music really does help make the best memories 👊🏻👊🏻,2025-11-05 14:21:06+00:00,0,just brilliant music really does help make the best memories,4,mixed evaluations (best vs worst),POSITIVE,0.9998809099197388
@truered4567,"Yet again John Lewis smashed the Christmas ads . Thanks, took me back. Great to see a father and his love for his son .",2025-11-05 14:18:42+00:00,0,"yet again john lewis smashed the christmas ads . thanks, took me back. great to see a father and his love for his son .",3,general christmas advert discussion,POSITIVE,0.5604338049888611
@lisahall1122,So sad this was my partners funeral song. The father son relationship my son doesn’t have so sad but so many amazing memories. I’ve never been so upset at an advert,2025-11-05 14:16:06+00:00,0,so sad this was my partners funeral song. the father son relationship my son doesn’t have so sad but so many amazing memories. i’ve never been so upset at an advert,1,strong emotional praise,POSITIVE,0.9972502589225769
@Jenson308,Makes no sense the worst advert I've ever seen,2025-11-05 14:15:59+00:00,1,makes no sense the worst advert i've ever seen,4,mixed evaluations (best vs worst),NEGATIVE,0.9998050332069397
@jacklowe1,Simple but exactly What’s was needed. 👍🏻,2025-11-05 14:00:46+00:00,0,simple but exactly what’s was needed.,2,nostalgia & memories,POSITIVE,0.9858062863349915
@nicolarae1306,"Have have early 90s raver parents....just hitting their 60s. The first few bars of Alison Limerick, where love lives, made me burst into tears. 😢",2025-11-05 14:00:03+00:00,26,"have have early 90s raver parents....just hitting their 60s. the first few bars of alison limerick, where love lives, made me burst into tears.",5,family themes & representation,POSITIVE,0.9724322557449341
@hello_kittycaysey1208,Huh? How is this making you cry ? I felt nothing but confusion,2025-11-05 13:53:47+00:00,2,huh? how is this making you cry ? i felt nothing but confusion,0,music themes & general praise,NEGATIVE,0.9956348538398743
@truthfactreality6814,Never felt appreciated as a father and man.  Thanks for this advert,2025-11-05 13:51:16+00:00,1,never felt appreciated as a father and man. thanks for this advert,3,general christmas advert discussion,POSITIVE,0.8527547121047974
@SEPK09,"Well done to JL for not bringing diversity into it FINALLY a worth while ad that's hits the generation, that strived for everything.",2025-11-05 13:32:10+00:00,1,"well done to jl for not bringing diversity into it finally a worth while ad that's hits the generation, that strived for everything.",2,nostalgia & memories,POSITIVE,0.98671954870224
@ElsieJoy39,Wish I understood this.....makes no sense,2025-11-05 13:25:15+00:00,0,wish i understood this.....makes no sense,2,nostalgia & memories,NEGATIVE,0.9997581839561462
@FinancialMatt,"Where would we be without John Lewis at Christmas. Absolutely nailed it, already won the best Christmas advert.",2025-11-05 13:14:03+00:00,2,"where would we be without john lewis at christmas. absolutely nailed it, already won the best christmas advert.",3,general christmas advert discussion,POSITIVE,0.9996944665908813
@gabryski193,"Absolute class .. the advert and the tune ,, Alison Limerick - Where Love Lives",2025-11-05 12:54:41+00:00,0,"absolute class .. the advert and the tune ,, alison limerick - where love lives",5,family themes & representation,POSITIVE,0.9994623064994812
@minatormyth,Nail directly on the head. Thankyou for this😢,2025-11-05 12:46:16+00:00,0,nail directly on the head. thankyou for this,0,music themes & general praise,POSITIVE,0.9995812773704529
@seanmckernan5377,Class !!!!! Was bot expecting that !!!!Well done john Lewis!!!!!! Brilliant!,2025-11-05 12:41:18+00:00,0,class !!!!! was bot expecting that !!!!well done john lewis!!!!!! brilliant!,3,general christmas advert discussion,POSITIVE,0.9993270635604858
@moirahyde750,I just don’t get the feels from this ad personally. Sorry,2025-11-05 12:23:50+00:00,0,i just don’t get the feels from this ad personally. sorry,0,music themes & general praise,NEGATIVE,0.999778687953949
@Christian-ju9zs,A white family for once - wow,2025-11-05 12:18:27+00:00,1,a white family for once - wow,5,family themes & representation,POSITIVE,0.9965645670890808
@dannygreen5968,Oh man…. take me back to those carefree days right now! Great advert 👏🏻👏🏻👏🏻👏🏻,2025-11-05 12:07:09+00:00,0,oh man…. take me back to those carefree days right now! great advert,5,family themes & representation,POSITIVE,0.9993427395820618
@anthonyluna352,An advert where the couple isn't a white women and black guy. Truly groundbreaking stuff,2025-11-05 11:58:51+00:00,0,an advert where the couple isn't a white women and black guy. truly groundbreaking stuff,4,mixed evaluations (best vs worst),POSITIVE,0.9992638230323792
@craig709,Great ad. Don’t know why it’s getting hate,2025-11-05 11:57:08+00:00,0,great ad. don’t know why it’s getting hate,0,music themes & general praise,POSITIVE,0.9985179305076599
@GaryWilliams-u7e,Beautiful advert,2025-11-05 11:55:24+00:00,0,beautiful advert,1,strong emotional praise,POSITIVE,0.9992746710777283
@phillpotts9047,"Lovely Ad, welcome back John Lewis 👏👏👏👏👏👏👏❤️❤️❤️",2025-11-05 11:39:14+00:00,1,"lovely ad, welcome back john lewis",3,general christmas advert discussion,POSITIVE,0.9998632669448853
@cal28kim,I was there 😭❗❗,2025-11-05 11:38:55+00:00,0,i was there,0,music themes & general praise,POSITIVE,0.8114876747131348
@markdarby1529,"Great advert, glad they didn’t do the diversity box ticking exercise while thinking of it",2025-11-05 11:30:11+00:00,2,"great advert, glad they didn’t do the diversity box ticking exercise while thinking of it",1,strong emotional praise,POSITIVE,0.9930934906005859
@Evec-o5g,Brilliant. Got the right people on this ad this year. Well done. Powerful.,2025-11-05 11:12:26+00:00,0,brilliant. got the right people on this ad this year. well done. powerful.,2,nostalgia & memories,POSITIVE,0.9998370409011841
@simonadamson9261,It’s a 10,2025-11-05 11:05:35+00:00,0,it’s a 10,0,music themes & general praise,POSITIVE,0.7447890043258667
@terryarrow702,"My father died when I was 9 years old, I’d have given anything to have bought him a gift as I grew up 😢 coz he was so generous & kind",2025-11-05 11:04:29+00:00,68,"my father died when i was 9 years old, i’d have given anything to have bought him a gift as i grew up coz he was so generous & kind",4,mixed evaluations (best vs worst),POSITIVE,0.9992741942405701
@Sam-tx1tn,A white heterosexual couple in an advert. Well done JL. Thank you.,2025-11-05 10:59:33+00:00,0,a white heterosexual couple in an advert. well done jl. thank you.,4,mixed evaluations (best vs worst),POSITIVE,0.9996709823608398
@JackMeadows6322,Quality advert,2025-11-05 10:59:28+00:00,0,quality advert,3,general christmas advert discussion,NEGATIVE,0.9905784726142883
@lambchop1601,I thought Male and Pale was stale? What happened? Will we miss the 2016-2024 era?,2025-11-05 10:56:10+00:00,0,i thought male and pale was stale? what happened? will we miss the 2016-2024 era?,2,nostalgia & memories,NEGATIVE,0.9995927214622498
@Lardwhalen,"Maybe it would be better to find the words. Really shouldn't be that hard. What a selfish, inward looking society we've become. Telling someone what they mean to you is worth more than an infinite amount of John Lewis gifts.",2025-11-05 10:51:37+00:00,0,"maybe it would be better to find the words. really shouldn't be that hard. what a selfish, inward looking society we've become. telling someone what they mean to you is worth more than an infinite amount of john lewis gifts.",3,general christmas advert discussion,POSITIVE,0.9991936087608337
@InnerCityGirl1,"I really like this one...JL has got its MoJo back for sure! great advert, and very touching. ❣❣❣❣❣❣",2025-11-05 10:42:57+00:00,0,"i really like this one...jl has got its mojo back for sure! great advert, and very touching.",3,general christmas advert discussion,POSITIVE,0.9998760223388672
@Aglaglagl123,"I would have thought this advert was too conservative for The Guardian?!?!?

Great advert that though.",2025-11-05 10:42:38+00:00,0,i would have thought this advert was too conservative for the guardian?!?!? great advert that though.,3,general christmas advert discussion,NEGATIVE,0.7521670460700989
@Angelfoodcakex-Yz7,"This is as powerful as the Sainsbury's ad in 2014 re-enacting the Christmas truce during WW1 1914... As a 52 year old ex 90s raver, and dad of a 19 year old son who is now at university, this hits hard... Beautiful",2025-11-05 10:34:39+00:00,1,"this is as powerful as the sainsbury's ad in 2014 re-enacting the christmas truce during ww1 1914... as a 52 year old ex 90s raver, and dad of a 19 year old son who is now at university, this hits hard... beautiful",2,nostalgia & memories,POSITIVE,0.9995397329330444
@beachlife2968,"I'm 100 per cent going to buy from John Lewis this year, purely because of how this advert made me feel.",2025-11-05 10:32:40+00:00,0,"i'm 100 per cent going to buy from john lewis this year, purely because of how this advert made me feel.",3,general christmas advert discussion,POSITIVE,0.9295510649681091
@Nicholalouise,Ouch,2025-11-05 10:31:52+00:00,0,ouch,0,music themes & general praise,POSITIVE,0.9480674862861633
@leefisher816,Omg well that tore me up,2025-11-05 10:27:24+00:00,0,omg well that tore me up,1,strong emotional praise,POSITIVE,0.9539928436279297
@michaeldemetriou3043,Wonderful Christmas 🎄 advert. The true meaning of Christmas 🎄 is family ❤,2025-11-05 10:20:08+00:00,0,wonderful christmas advert. the true meaning of christmas is family,1,strong emotional praise,POSITIVE,0.9998757839202881
@blackporscheroadster-yw8hb,"I can relate to this about the 90s raving part as was a teenager in the early 90s, but I don't have a son, so the rest just seems a bit depressing to me. Don't like the cheesy tune either and it's not very Christmassy.",2025-11-05 10:16:20+00:00,0,"i can relate to this about the 90s raving part as was a teenager in the early 90s, but i don't have a son, so the rest just seems a bit depressing to me. don't like the cheesy tune either and it's not very christmassy.",1,strong emotional praise,NEGATIVE,0.9994739890098572
@Lee-sv8su,Prepare for a Xmas number one from Alison Limerick great advert,2025-11-05 10:16:00+00:00,0,prepare for a xmas number one from alison limerick great advert,5,family themes & representation,POSITIVE,0.9890779852867126
@somechrisguy,"i am 29 yr old with 2 young boys, my dad is 56 and was a raver who got me into it in my early 20's... right in the feels",2025-11-05 10:12:29+00:00,0,"i am 29 yr old with 2 young boys, my dad is 56 and was a raver who got me into it in my early 20's... right in the feels",2,nostalgia & memories,POSITIVE,0.9991669654846191
@djherbie-qx7dg,Excellent and what a massive tune ❤🥳🥳🥳🥳🥳🥂🙌,2025-11-05 10:12:03+00:00,0,excellent and what a massive tune 🥳🥳🥳🥳🥳🥂,3,general christmas advert discussion,POSITIVE,0.9998663663864136
@MrDeltaHotel,"WOW! Absolutely LOVE this advert - it made the hairs on the back of my neck stand up as it brings back such amazing memories growing up in the early 90s dancing to Where Love Lives by Alison Limerick and a gift like this would be the perfect Christmas present for own dad. Brilliant, well done John Lewis.",2025-11-05 10:11:00+00:00,0,"wow! absolutely love this advert - it made the hairs on the back of my neck stand up as it brings back such amazing memories growing up in the early 90s dancing to where love lives by alison limerick and a gift like this would be the perfect christmas present for own dad. brilliant, well done john lewis.",5,family themes & representation,POSITIVE,0.9998629093170166
@markhartfield8186,AT LAST. ❤,2025-11-05 10:10:28+00:00,0,at last.,0,music themes & general praise,POSITIVE,0.9762411713600159
@hx7193,Dads are so important ❤❤❤❤❤❤❤,2025-11-05 10:10:05+00:00,0,dads are so important,0,music themes & general praise,NEGATIVE,0.9483993053436279
@williammartyn,Well done John Lewis. This is a beaut.,2025-11-05 09:57:08+00:00,0,well done john lewis. this is a beaut.,3,general christmas advert discussion,POSITIVE,0.9998143315315247
@louisehardy6125,Best yet!,2025-11-05 09:55:06+00:00,0,best yet!,4,mixed evaluations (best vs worst),POSITIVE,0.9996143579483032
@vanthecatp3001,They knocking out old vinyl 💿 this year then?,2025-11-05 09:52:08+00:00,0,they knocking out old vinyl this year then?,2,nostalgia & memories,NEGATIVE,0.9934438467025757
@tubewayarmy1979,"Super video.
Does anyone know what Bauhaus print is on the staircase wall ?
I looked at hundreds all over the Internet..  not been able to locate it.",2025-11-05 09:51:07+00:00,0,super video. does anyone know what bauhaus print is on the staircase wall ? i looked at hundreds all over the internet.. not been able to locate it.,5,family themes & representation,NEGATIVE,0.9995779395103455
@carol-anneturner6529,Captured the awkwardness of youth. JL have smashed it this year. That boy looks like could have a long career…,2025-11-05 09:50:22+00:00,0,captured the awkwardness of youth. jl have smashed it this year. that boy looks like could have a long career…,2,nostalgia & memories,NEGATIVE,0.9844186305999756
@BestDentistvietnam,❤❤❤❤❤❤ love it . The best British Christmas advert I have ever seen. Talk about selling the sizzle and not the the sausage. Who ever made this is a geniuses at last adverts I can enjoy again x,2025-11-05 09:46:18+00:00,0,love it . the best british christmas advert i have ever seen. talk about selling the sizzle and not the the sausage. who ever made this is a geniuses at last adverts i can enjoy again x,5,family themes & representation,POSITIVE,0.9995960593223572
@djgaz7872,"You can't buy old school vinyl at John Lewis,  just saying 😂",2025-11-05 09:36:52+00:00,2,"you can't buy old school vinyl at john lewis, just saying",5,family themes & representation,NEGATIVE,0.9750438928604126
@Fireballxyz,"Long lost dad, long lost son. With the hug, Christmas makes perfect sense.",2025-11-05 09:32:48+00:00,6,"long lost dad, long lost son. with the hug, christmas makes perfect sense.",3,general christmas advert discussion,POSITIVE,0.9998397827148438
@neilpearce,"What a track to use, absolute classic! Talk to your kids, Dads! 😉",2025-11-05 09:19:50+00:00,0,"what a track to use, absolute classic! talk to your kids, dads!",1,strong emotional praise,POSITIVE,0.998988687992096
@YvonneOldfield,Brilliant advert for many reasons..know what i mean?  Patriotism❤,2025-11-05 09:05:22+00:00,0,brilliant advert for many reasons..know what i mean? patriotism,1,strong emotional praise,POSITIVE,0.9990328550338745
@tipsypittsy123,Best Christmas advert ever!,2025-11-05 09:01:52+00:00,0,best christmas advert ever!,4,mixed evaluations (best vs worst),NEGATIVE,0.947500467300415
@lemarnewell-phillips68,Are John Lewis selling vinyls,2025-11-05 08:57:24+00:00,0,are john lewis selling vinyls,3,general christmas advert discussion,POSITIVE,0.8469619154930115
@johndh958,At last!!!  John Lewis get it,2025-11-05 08:53:25+00:00,0,at last!!! john lewis get it,3,general christmas advert discussion,POSITIVE,0.9992895126342773
@MrStraightGangsta,As a dad of 4 boys who have all had their teens stolen by our broken society this hits hard,2025-11-05 08:48:32+00:00,0,as a dad of 4 boys who have all had their teens stolen by our broken society this hits hard,2,nostalgia & memories,NEGATIVE,0.9533206820487976
