author,text,published_at,likes,clean_text,topic_id,topic_label,sentiment_label,sentiment_score
@SteeeV-q8t,"Why was Santa banned from Myanmar?
Because Santa ate Mymin spies.",2025-11-04 18:49:00+00:00,0,why was santa banned from myanmar? because santa ate mymin spies.,0,music themes & general praise,NEGATIVE,0.9988584518432617
@glamourous1980,Omg this is just the perfect advert ❤ 😢,2025-11-04 18:48:23+00:00,0,omg this is just the perfect advert,1,strong emotional praise,POSITIVE,0.9989292025566101
@lindagoodswin9519,It is a nice ad but not very christmas like,2025-11-04 18:40:35+00:00,0,it is a nice ad but not very christmas like,0,music themes & general praise,NEGATIVE,0.9860225915908813
@markjordan750,OMG that was insane!!!!!!!!!!!! 'Where Love Lives' was MY JAM in the 90s! I went directly back to the club!!!!!!!!!!!!!!!!!!!! It so has to chart again!,2025-11-04 18:38:29+00:00,0,omg that was insane!!!!!!!!!!!! 'where love lives' was my jam in the 90s! i went directly back to the club!!!!!!!!!!!!!!!!!!!! it so has to chart again!,1,strong emotional praise,NEGATIVE,0.9898307919502258
@TeamBobRat,"Well, the creators have seen aftersun. Masterfully done though",2025-11-04 18:38:22+00:00,0,"well, the creators have seen aftersun. masterfully done though",4,mixed evaluations (best vs worst),POSITIVE,0.9996209144592285
@clairehoare8764,This was just what we all needed 🎉,2025-11-04 18:35:54+00:00,0,this was just what we all needed,2,nostalgia & memories,POSITIVE,0.9989123344421387
@stevevendy5753,Glad I don't buy the guardian,2025-11-04 18:31:32+00:00,0,glad i don't buy the guardian,2,nostalgia & memories,NEGATIVE,0.7154613137245178
@lb1116,"Also a hot Dad, thanks John Lewis for some eye candy (sorry I had to lighten the mood) ❤️😅🎄🥹",2025-11-04 18:25:46+00:00,0,"also a hot dad, thanks john lewis for some eye candy (sorry i had to lighten the mood) 🥹",3,general christmas advert discussion,POSITIVE,0.9994114637374878
@anthonykempton1414,This advert was written for me -,2025-11-04 18:22:12+00:00,1,this advert was written for me -,3,general christmas advert discussion,NEGATIVE,0.9930526614189148
@DenisTynan,The worst Christian ad ever...best one was the fire breathing dragon a few years ago,2025-11-04 18:21:40+00:00,0,the worst christian ad ever...best one was the fire breathing dragon a few years ago,4,mixed evaluations (best vs worst),NEGATIVE,0.9997782111167908
@NickWard-f6l,Gen x unite ...we had the best years ...Banging tune .,2025-11-04 18:19:26+00:00,0,gen x unite ...we had the best years ...banging tune .,4,mixed evaluations (best vs worst),POSITIVE,0.9983104467391968
@mrdee3561,"As a once single Dad who brought up two sons, I totally get this. A family rift means that I don't see my first born, 40 year old son much. Communication is definitely  the key.",2025-11-04 18:16:46+00:00,7,"as a once single dad who brought up two sons, i totally get this. a family rift means that i don't see my first born, 40 year old son much. communication is definitely the key.",2,nostalgia & memories,POSITIVE,0.9908347129821777
@jacob-e8c,BRILLIANT! Got me again! 🥹👌😍,2025-11-04 18:04:16+00:00,3,brilliant! got me again! 🥹,1,strong emotional praise,POSITIVE,0.9998582601547241
@WDH59510,"As the father of a teenage boy, this ad speaks to me. Well played John Lewis.",2025-11-04 17:55:10+00:00,4,"as the father of a teenage boy, this ad speaks to me. well played john lewis.",2,nostalgia & memories,POSITIVE,0.9997110962867737
@leslieleatham4601,Awesome,2025-11-04 17:51:19+00:00,2,awesome,0,music themes & general praise,POSITIVE,0.9877891540527344
@straightouttacornwall,Old skool was the best school,2025-11-04 17:47:14+00:00,2,old skool was the best school,4,mixed evaluations (best vs worst),POSITIVE,0.9997431635856628
@SometimesYouJustGottaSayIt,this hits hard,2025-11-04 17:44:42+00:00,1,this hits hard,2,nostalgia & memories,POSITIVE,0.9979023933410645
@Ab-w2b,Love this!,2025-11-04 17:39:09+00:00,1,love this!,5,family themes & representation,POSITIVE,0.9986534118652344
@daveGraham86,Wow 🥲,2025-11-04 17:37:22+00:00,1,wow 🥲,5,family themes & representation,POSITIVE,0.8769633769989014
@TheGamingPile,I just don't understand what the advert is about?,2025-11-04 17:35:34+00:00,1,i just don't understand what the advert is about?,0,music themes & general praise,NEGATIVE,0.9996691942214966
@fleece96,"Not a big fan of Christmas adverts and all that stuff, but John Lewis... offt got my heartstrings x",2025-11-04 17:29:35+00:00,1,"not a big fan of christmas adverts and all that stuff, but john lewis... offt got my heartstrings x",3,general christmas advert discussion,POSITIVE,0.9638751149177551
@jamestaylor3836,At last a decent advert. Well done John Lewis👌,2025-11-04 17:28:34+00:00,1,at last a decent advert. well done john lewis,3,general christmas advert discussion,POSITIVE,0.9996304512023926
@tonyg4538,Best ever JL ad and no one else is going to be able to top that ad this Xmas.,2025-11-04 17:26:37+00:00,70,best ever jl ad and no one else is going to be able to top that ad this xmas.,3,general christmas advert discussion,NEGATIVE,0.9743082523345947
@kaystar1844,Its great to see finally fathers being represented as a figure who also deserves love just as much as mothers. They matter too❤,2025-11-04 17:20:01+00:00,1083,its great to see finally fathers being represented as a figure who also deserves love just as much as mothers. they matter too,4,mixed evaluations (best vs worst),POSITIVE,0.9995728135108948
@tinamartin8890,The advert could have hit so much harder with a better song. In my opinion,2025-11-04 17:18:27+00:00,1,the advert could have hit so much harder with a better song. in my opinion,5,family themes & representation,NEGATIVE,0.9986553192138672
@rebeccacorrigan9142,Americans,2025-11-04 17:12:18+00:00,0,americans,0,music themes & general praise,POSITIVE,0.9833610653877258
@ShabbaNasty,Finally a decent one! More emotional and less gimmicky,2025-11-04 17:10:18+00:00,0,finally a decent one! more emotional and less gimmicky,2,nostalgia & memories,POSITIVE,0.9876856803894043
@Paddy-p2g,CHOON!,2025-11-04 17:04:48+00:00,0,choon!,0,music themes & general praise,POSITIVE,0.9973781108856201
@paulpotter8466,Best ad ever well done,2025-11-04 17:04:02+00:00,0,best ad ever well done,4,mixed evaluations (best vs worst),POSITIVE,0.9374794363975525
@annac8228,Thought the ad was naff til reading the comments,2025-11-04 16:54:40+00:00,0,thought the ad was naff til reading the comments,3,general christmas advert discussion,NEGATIVE,0.999150276184082
@lesgutsche6279,Beautiful. ❤,2025-11-04 16:47:15+00:00,1,beautiful.,1,strong emotional praise,POSITIVE,0.9994996786117554
@kellieb3117,Nailed it 👌🏼👌🏼👌🏼 best one yet John Lewis,2025-11-04 16:42:09+00:00,4,nailed it best one yet john lewis,3,general christmas advert discussion,POSITIVE,0.9997146725654602
@robbymacbeath,"A strong, simple but effective message ”if you can’t find the words, find the gift“. No frills advertising and John Lewis going back to the basics, at long last!  🎄
Well done team, from a raver Dad with a misspent youth 😲",2025-11-04 16:34:50+00:00,1,"a strong, simple but effective message ”if you can’t find the words, find the gift“. no frills advertising and john lewis going back to the basics, at long last! well done team, from a raver dad with a misspent youth",3,general christmas advert discussion,POSITIVE,0.9992590546607971
@Gaf68TV,"Excellent advert, congratulations John Lewis",2025-11-04 16:34:25+00:00,8,"excellent advert, congratulations john lewis",3,general christmas advert discussion,POSITIVE,0.9998461008071899
@trudig4258,That's me and my girls (friends since childhood) tune! ❤️,2025-11-04 16:30:33+00:00,1,that's me and my girls (friends since childhood) tune!,0,music themes & general praise,POSITIVE,0.9994919300079346
@glenr4026,Don’t do drugs I think is the message,2025-11-04 16:29:16+00:00,5,don’t do drugs i think is the message,0,music themes & general praise,POSITIVE,0.9723014831542969
@darreno2428,This is me and my son 100%. This was the tune of my raving youth. I often go into day dreams like that when listening to it. Watching this made me cry.,2025-11-04 16:25:16+00:00,2,this is me and my son 100%. this was the tune of my raving youth. i often go into day dreams like that when listening to it. watching this made me cry.,1,strong emotional praise,POSITIVE,0.9902398586273193
@amysergenson482,This is beautiful ❤❤,2025-11-04 16:23:28+00:00,0,this is beautiful,1,strong emotional praise,POSITIVE,0.999631404876709
@jonwiganrobby,I'm getting sixth sense vibes... hope I'm wrong,2025-11-04 16:22:42+00:00,0,i'm getting sixth sense vibes... hope i'm wrong,0,music themes & general praise,NEGATIVE,0.9962756633758545
@neilhastie6283,It’s a winner!!,2025-11-04 16:19:52+00:00,0,it’s a winner!!,0,music themes & general praise,POSITIVE,0.9998555183410645
@ghosthorse77,"What a load of rubbish! The comments below, bots, AI, and paid comments. People I read have all said how bad it is, and I agree.",2025-11-04 16:12:07+00:00,2,"what a load of rubbish! the comments below, bots, ai, and paid comments. people i read have all said how bad it is, and i agree.",4,mixed evaluations (best vs worst),NEGATIVE,0.9993871450424194
@supermariobruvva,We all saw Aftersun,2025-11-04 16:06:08+00:00,0,we all saw aftersun,3,general christmas advert discussion,POSITIVE,0.8877533078193665
@theromanceofwax,This mofucker made me cry my eyes out. My sons love house music just like me. Cant wait till we can experience it all together,2025-11-04 16:04:49+00:00,2,this mofucker made me cry my eyes out. my sons love house music just like me. cant wait till we can experience it all together,0,music themes & general praise,POSITIVE,0.9975904226303101
@markrooney3790,"Not a bad try, but still has nothing on Kevin the Carrot.🥕",2025-11-04 16:00:58+00:00,2,"not a bad try, but still has nothing on kevin the carrot.🥕",3,general christmas advert discussion,NEGATIVE,0.9982224106788635
@Philosoph-ali,I’ve got access to the kids but they don’t wanna see me,2025-11-04 15:59:56+00:00,1,i’ve got access to the kids but they don’t wanna see me,0,music themes & general praise,NEGATIVE,0.9877927899360657
@Ftanftangfnarrr,Did the daughter buy the pills to go with it?,2025-11-04 15:55:43+00:00,1,did the daughter buy the pills to go with it?,5,family themes & representation,NEGATIVE,0.9980648159980774
@familyadventuredays1203,Research Please? I’d love to see some research how brands spending tens of millions on these Xmas adverts gets people in the store? If you shop at John Lewis you already shop there or go in for a product… these generic brand adverts don’t make me want to go shop in John Lewis. If they said we have this product and it’s £20 cheaper then Argos I’d go in,2025-11-04 15:53:40+00:00,1,research please? i’d love to see some research how brands spending tens of millions on these xmas adverts gets people in the store? if you shop at john lewis you already shop there or go in for a product… these generic brand adverts don’t make me want to go shop in john lewis. if they said we have this product and it’s £20 cheaper then argos i’d go in,3,general christmas advert discussion,NEGATIVE,0.9745803475379944
@sarahsselection,"Love John Lewis, dislike this advert 😂",2025-11-04 15:46:14+00:00,3,"love john lewis, dislike this advert",3,general christmas advert discussion,NEGATIVE,0.9501771926879883
@FoxM,Definitely got inspiration from the movie Aftersun with Paul Mescal,2025-11-04 15:43:57+00:00,2,definitely got inspiration from the movie aftersun with paul mescal,3,general christmas advert discussion,POSITIVE,0.9993144273757935
@pwizzle1212,This is just lifted from a scene in Aftersun.,2025-11-04 15:40:37+00:00,17,this is just lifted from a scene in aftersun.,5,family themes & representation,POSITIVE,0.9791198372840881
@roberttotten8874,I do miss my old club days but what I have now with my family/son is worth so much more. Lovely advert recognising love between a father and son ❤,2025-11-04 15:38:55+00:00,3,i do miss my old club days but what i have now with my family/son is worth so much more. lovely advert recognising love between a father and son,5,family themes & representation,POSITIVE,0.9998629093170166
@andrewallsop7856,I thought it gave the impression he was blind ?,2025-11-04 15:37:03+00:00,0,i thought it gave the impression he was blind ?,3,general christmas advert discussion,NEGATIVE,0.9997188448905945
@StumpyHead79,Brilliant add,2025-11-04 15:27:51+00:00,0,brilliant add,4,mixed evaluations (best vs worst),POSITIVE,0.9980340600013733
@JeremyWithers1,"This feels very heavily inspired by the film Aftersun. It's a masterpiece and if you are reading this comment, do yourself a favour and go watch it.",2025-11-04 15:26:02+00:00,2,"this feels very heavily inspired by the film aftersun. it's a masterpiece and if you are reading this comment, do yourself a favour and go watch it.",2,nostalgia & memories,POSITIVE,0.9991766810417175
@Macphisto77,Shame your newspaper completely slated it.  After reading your article you should be ashamed of yourselves.,2025-11-04 15:24:56+00:00,1,shame your newspaper completely slated it. after reading your article you should be ashamed of yourselves.,4,mixed evaluations (best vs worst),NEGATIVE,0.9995125532150269
@yougiveloveabadname2,Best Christmas advert ever,2025-11-04 15:20:00+00:00,1,best christmas advert ever,4,mixed evaluations (best vs worst),POSITIVE,0.5609961748123169
@danmullins890,What merch is John Lewis gonna tie in with this? Half a dove and a bottle of water gift pack? 💊,2025-11-04 15:19:46+00:00,2,what merch is john lewis gonna tie in with this? half a dove and a bottle of water gift pack?,3,general christmas advert discussion,NEGATIVE,0.9958613514900208
@francescakerr8433,My baby was born on Christmas Eve 2024. This has been the best year of my life. It’s going way to quick though. This got me ❤️,2025-11-04 15:18:47+00:00,3,my baby was born on christmas eve 2024. this has been the best year of my life. it’s going way to quick though. this got me,1,strong emotional praise,POSITIVE,0.9996869564056396
@anne-marie2407,I LOVE LOVE LOVE IT ❤❤❤❤❤,2025-11-04 15:11:41+00:00,0,i love love love it,5,family themes & representation,POSITIVE,0.9753459095954895
@mattdedasc,This was great. A bit shocked to see a white British family celebrating traditional things with a very relatable story. Well done. Well done,2025-11-04 15:09:50+00:00,3,this was great. a bit shocked to see a white british family celebrating traditional things with a very relatable story. well done. well done,5,family themes & representation,POSITIVE,0.9998233914375305
@Gullsz,"What’s ya name, where ya from, wot ya on.",2025-11-04 15:06:08+00:00,0,"what’s ya name, where ya from, wot ya on.",0,music themes & general praise,NEGATIVE,0.9969708919525146
@jacobrist5537,Anyone know what the blue sweater is?,2025-11-04 15:04:34+00:00,0,anyone know what the blue sweater is?,0,music themes & general praise,NEGATIVE,0.9900913238525391
@pierre4771,Superb advert,2025-11-04 15:04:21+00:00,0,superb advert,1,strong emotional praise,NEGATIVE,0.7088767290115356
@AlisonMoore-x3h,What a blast from my past.  Love that this song will be everywhere now 🎵,2025-11-04 14:58:53+00:00,0,what a blast from my past. love that this song will be everywhere now,5,family themes & representation,POSITIVE,0.9996084570884705
@krisgater6891,Another unrealistic cheesy advert thought up by college graduates with issues..,2025-11-04 14:55:48+00:00,1,another unrealistic cheesy advert thought up by college graduates with issues..,3,general christmas advert discussion,NEGATIVE,0.9996523857116699
@dietchipsacro7077,"Brilliant advert and very relatable, I was expecting something awful after reading what  The Guardian writer Stuart Heritage wrote about it. If you can't find this moving and endearing, I actually feel sorry for you, as you have had something missing in your early and later life.",2025-11-04 14:48:31+00:00,3,"brilliant advert and very relatable, i was expecting something awful after reading what the guardian writer stuart heritage wrote about it. if you can't find this moving and endearing, i actually feel sorry for you, as you have had something missing in your early and later life.",4,mixed evaluations (best vs worst),NEGATIVE,0.9745833277702332
@426john,Wow !!  A White family !,2025-11-04 14:45:57+00:00,4,wow !! a white family !,5,family themes & representation,POSITIVE,0.9997614026069641
@psrpippy,Absolutely guarantee this will be back in the charts by December.  A Christmas number 1 I hope.,2025-11-04 14:42:06+00:00,44,absolutely guarantee this will be back in the charts by december. a christmas number 1 i hope.,0,music themes & general praise,POSITIVE,0.9997978806495667
@jakkiglasgow8635,Memories  are what make cry x,2025-11-04 14:32:48+00:00,1,memories are what make cry x,3,general christmas advert discussion,POSITIVE,0.9631474614143372
@JennaLeeAnderson,This is a fantastic ad. Well done 🎉,2025-11-04 14:22:54+00:00,0,this is a fantastic ad. well done,0,music themes & general praise,POSITIVE,0.9998666048049927
@CUSTARDMIKE,Middle aged white man being portrayed in a positive light! That’s Gary Neville’s custom John Lewis have lost.,2025-11-04 14:22:54+00:00,0,middle aged white man being portrayed in a positive light! that’s gary neville’s custom john lewis have lost.,4,mixed evaluations (best vs worst),POSITIVE,0.8335864543914795
@BRFCBlueWhiteArmy,"LOVE THIS. 
One for the Dads
One for the lads that found love in the club and kids
We never grow out of that feeling 🎶",2025-11-04 14:22:13+00:00,12,love this. one for the dads one for the lads that found love in the club and kids we never grow out of that feeling,5,family themes & representation,POSITIVE,0.9998691082000732
@blujez,"CALL THE COPS, DAD'S OFF HIS CHOPS",2025-11-04 14:11:49+00:00,20,"call the cops, dad's off his chops",4,mixed evaluations (best vs worst),NEGATIVE,0.9993305206298828
@Coach_luciamizzoni,Absolutely love this! Probably the best ad ever watched!! Cried so much watching it! My son is 17 and my husband is such an amazing dad! He teared up too! ❤❤❤❤❤❤❤❤❤❤❤,2025-11-04 14:01:52+00:00,18,absolutely love this! probably the best ad ever watched!! cried so much watching it! my son is 17 and my husband is such an amazing dad! he teared up too!,0,music themes & general praise,POSITIVE,0.9998654127120972
@Daz-jw9sn,Someone explain what the advert is ? I’m a dad and grandad and this tune is unreal BTW.. but I’m getting mixed feelings about it ❤,2025-11-04 13:57:13+00:00,0,someone explain what the advert is ? i’m a dad and grandad and this tune is unreal btw.. but i’m getting mixed feelings about it,4,mixed evaluations (best vs worst),NEGATIVE,0.9973020553588867
@Daz-jw9sn,What a tune 🎵,2025-11-04 13:53:24+00:00,3,what a tune,0,music themes & general praise,POSITIVE,0.986880898475647
@joanne42-l55,I think is the best advert I've watched in a long time. Not just christmas advert the best advert.,2025-11-04 13:38:39+00:00,169,i think is the best advert i've watched in a long time. not just christmas advert the best advert.,4,mixed evaluations (best vs worst),POSITIVE,0.9997089505195618
@davidhazell2129,"Best Christmas ad for a very very long time well done, John Lewis",2025-11-04 13:36:49+00:00,3,"best christmas ad for a very very long time well done, john lewis",3,general christmas advert discussion,POSITIVE,0.9989221096038818
@3boysproud,Brilliant best house music tune EVER,2025-11-04 13:35:15+00:00,1,brilliant best house music tune ever,0,music themes & general praise,POSITIVE,0.9964579939842224
@hayleydavenport7913,"Definitely gone in on a certain audience, let’s hope it’s not too upsetting for a lot of children out there 😬 and it hits where it should 🙏 … merry Christmas 🎄",2025-11-04 13:33:54+00:00,2,"definitely gone in on a certain audience, let’s hope it’s not too upsetting for a lot of children out there and it hits where it should … merry christmas",2,nostalgia & memories,POSITIVE,0.9996340274810791
@jah7190,Finally! A great advert ❤,2025-11-04 13:25:24+00:00,5,finally! a great advert,5,family themes & representation,POSITIVE,0.9973219037055969
@keramccann343,I cry every year at these adverts. This year was no exception haha but I blame the pregnancyhormones too. Lovely advert,2025-11-04 13:23:27+00:00,0,i cry every year at these adverts. this year was no exception haha but i blame the pregnancyhormones too. lovely advert,3,general christmas advert discussion,POSITIVE,0.9783249497413635
@francescajohnston6194,It's not an ad.. it's literally ripped off aftersun?,2025-11-04 13:21:35+00:00,1,it's not an ad.. it's literally ripped off aftersun?,3,general christmas advert discussion,NEGATIVE,0.9997721314430237
@aleugenio,Wow! It brought me tears... The memories that music can give us. Alison Limerick on loop during the festive season! ✊🏽💖🎶🪩🌲,2025-11-04 13:19:43+00:00,0,wow! it brought me tears... the memories that music can give us. alison limerick on loop during the festive season! 🪩,5,family themes & representation,POSITIVE,0.9991150498390198
@inkeriperonius6107,Still love the Boxer doggo!,2025-11-04 13:14:55+00:00,0,still love the boxer doggo!,5,family themes & representation,POSITIVE,0.9994445443153381
@adeventuresuk,Well it certainly got me 🙏🙏🙏,2025-11-04 13:12:02+00:00,0,well it certainly got me,1,strong emotional praise,POSITIVE,0.9860450625419617
@se4nyboy,Well this country has pretty much killed Christmas any way as well as any other Christian holiday but the add is bad,2025-11-04 13:11:09+00:00,0,well this country has pretty much killed christmas any way as well as any other christian holiday but the add is bad,4,mixed evaluations (best vs worst),NEGATIVE,0.9993221759796143
@Carmine_Lupertazzi,"Well done JL, I actually cried in front of my son whilst watching this. Best commercial I've seen in over a decade.  Merry Christmas x",2025-11-04 13:10:22+00:00,24,"well done jl, i actually cried in front of my son whilst watching this. best commercial i've seen in over a decade. merry christmas x",4,mixed evaluations (best vs worst),POSITIVE,0.9995478987693787
@georgedalton3873,Very well done John Lewis for the terrific 2025 Christmas Advert.,2025-11-04 13:06:17+00:00,0,very well done john lewis for the terrific 2025 christmas advert.,3,general christmas advert discussion,POSITIVE,0.9998103976249695
@C.P-t8i,Aftersun will see you in court,2025-11-04 13:04:53+00:00,7,aftersun will see you in court,3,general christmas advert discussion,POSITIVE,0.9981207251548767
@DjJDtech,what a miserable xmas advert,2025-11-04 13:04:29+00:00,2,what a miserable xmas advert,3,general christmas advert discussion,NEGATIVE,0.9998050332069397
@394pjo,A very clever way of deliberately toning down the christian imagery and festivities that has always been central to all previous John Lewis Ads. And judging by the comments here it has worked a treat.,2025-11-04 13:04:17+00:00,0,a very clever way of deliberately toning down the christian imagery and festivities that has always been central to all previous john lewis ads. and judging by the comments here it has worked a treat.,3,general christmas advert discussion,POSITIVE,0.9995571970939636
@TheRedhot47,"Nostalgia and love, you can't go wrong with that for the Christmas period... love it ❤",2025-11-04 13:00:47+00:00,1,"nostalgia and love, you can't go wrong with that for the christmas period... love it",5,family themes & representation,POSITIVE,0.9998666048049927
@annekathleen4498,I think it's beautiful. We need more positive images of dad's.,2025-11-04 13:00:09+00:00,328,i think it's beautiful. we need more positive images of dad's.,4,mixed evaluations (best vs worst),POSITIVE,0.9987278580665588
@RogueWJL,"Beautiful.

Premier choice of music-one of the finest from the fabulous 1990s.",2025-11-04 12:58:31+00:00,0,beautiful. premier choice of music-one of the finest from the fabulous 1990s.,0,music themes & general praise,POSITIVE,0.9998856782913208
@AsianChubbiBunni,WTH I literally used this marketing concept using an old man and all being transported in time through music.,2025-11-04 12:51:07+00:00,0,wth i literally used this marketing concept using an old man and all being transported in time through music.,2,nostalgia & memories,NEGATIVE,0.9433716535568237
@pzmills,"I was too young to rave in the 90s but this song got me dancing at my desk while WFH, then the change in tempo 😢 - great ad!",2025-11-04 12:49:19+00:00,5,"i was too young to rave in the 90s but this song got me dancing at my desk while wfh, then the change in tempo - great ad!",2,nostalgia & memories,POSITIVE,0.9988558292388916
@benmorris697,*watches aftersun once*,2025-11-04 12:48:29+00:00,1,*watches aftersun once*,3,general christmas advert discussion,NEGATIVE,0.8500496745109558
@katieprandle5613,Was amazing until whoever started singing the slowed down version.,2025-11-04 12:43:21+00:00,0,was amazing until whoever started singing the slowed down version.,1,strong emotional praise,POSITIVE,0.9993206262588501
@Ennahdee,Ebeneezer Goode would've been a better choice,2025-11-04 12:40:44+00:00,2,ebeneezer goode would've been a better choice,0,music themes & general praise,NEGATIVE,0.9902452230453491
@lockleaze,So what is the “official” John Lewis Xmas ad? Because I thought it was the Angel on the tree one?,2025-11-04 12:39:58+00:00,0,so what is the “official” john lewis xmas ad? because i thought it was the angel on the tree one?,3,general christmas advert discussion,NEGATIVE,0.9987226128578186
